{
  "id": 18,
  "title": "Seviye 18: Ağır Sanayi Ustalığı",
  "mode": "progressive",
  "district": "industrial",
  "levelFamily": "mastery",
  "primaryChallenge": "Bölge 3 Ustalık Sınavı",
  "manifest": [
    "R",
    "B",
    "G",
    "Y",
    "R",
    "B",
    "G"
  ],
  "tickDurationMs": 750,
  "spawnCadenceTicks": 2,
  "activeJunctions": [
    "J1",
    "J2",
    "J3"
  ],
  "initialJ1": "LEFT",
  "initialJ2": "RED",
  "initialJ3": "GREEN",
  "maxMistakes": 2,
  "maxConcurrentVehicles": 3,
  "spawnPreparationMs": 1000,
  "hint": "Ağır Sanayi Sevkiyat Ustalığı! Hata payı sadece 1."
}