[
  {
    "id": 1,
    "title": "Senaryo 1",
    "mode": "classic",
    "district": null,
    "levelFamily": null,
    "primaryChallenge": null,
    "manifest": [
      "R",
      "B",
      "R",
      "B",
      "R",
      "B"
    ],
    "tickDurationMs": 700,
    "spawnCadenceTicks": 2,
    "activeJunctions": [
      "J1",
      "J2",
      "J3"
    ],
    "initialJ1": "LEFT",
    "initialJ2": "RED",
    "initialJ3": "GREEN",
    "maxMistakes": 3,
    "maxConcurrentVehicles": null,
    "spawnPreparationMs": null,
    "hint": null
  },
  {
    "id": 2,
    "title": "Senaryo 2",
    "mode": "classic",
    "district": null,
    "levelFamily": null,
    "primaryChallenge": null,
    "manifest": [
      "G",
      "Y",
      "G",
      "Y",
      "G",
      "Y"
    ],
    "tickDurationMs": 700,
    "spawnCadenceTicks": 2,
    "activeJunctions": [
      "J1",
      "J2",
      "J3"
    ],
    "initialJ1": "LEFT",
    "initialJ2": "RED",
    "initialJ3": "GREEN",
    "maxMistakes": 3,
    "maxConcurrentVehicles": null,
    "spawnPreparationMs": null,
    "hint": null
  },
  {
    "id": 3,
    "title": "Senaryo 3",
    "mode": "classic",
    "district": null,
    "levelFamily": null,
    "primaryChallenge": null,
    "manifest": [
      "R",
      "G",
      "B",
      "Y",
      "R",
      "G"
    ],
    "tickDurationMs": 700,
    "spawnCadenceTicks": 2,
    "activeJunctions": [
      "J1",
      "J2",
      "J3"
    ],
    "initialJ1": "LEFT",
    "initialJ2": "RED",
    "initialJ3": "GREEN",
    "maxMistakes": 3,
    "maxConcurrentVehicles": null,
    "spawnPreparationMs": null,
    "hint": null
  },
  {
    "id": 4,
    "title": "Senaryo 4",
    "mode": "classic",
    "district": null,
    "levelFamily": null,
    "primaryChallenge": null,
    "manifest": [
      "R",
      "B",
      "G",
      "Y",
      "B",
      "R",
      "G",
      "Y"
    ],
    "tickDurationMs": 700,
    "spawnCadenceTicks": 2,
    "activeJunctions": [
      "J1",
      "J2",
      "J3"
    ],
    "initialJ1": "LEFT",
    "initialJ2": "RED",
    "initialJ3": "GREEN",
    "maxMistakes": 3,
    "maxConcurrentVehicles": null,
    "spawnPreparationMs": null,
    "hint": null
  },
  {
    "id": 5,
    "title": "Senaryo 5",
    "mode": "classic",
    "district": null,
    "levelFamily": null,
    "primaryChallenge": null,
    "manifest": [
      "Y",
      "Y",
      "G",
      "R",
      "B",
      "B",
      "G",
      "R"
    ],
    "tickDurationMs": 700,
    "spawnCadenceTicks": 2,
    "activeJunctions": [
      "J1",
      "J2",
      "J3"
    ],
    "initialJ1": "LEFT",
    "initialJ2": "RED",
    "initialJ3": "GREEN",
    "maxMistakes": 3,
    "maxConcurrentVehicles": null,
    "spawnPreparationMs": null,
    "hint": null
  },
  {
    "id": 6,
    "title": "Senaryo 6",
    "mode": "classic",
    "district": null,
    "levelFamily": null,
    "primaryChallenge": null,
    "manifest": [
      "R",
      "G",
      "R",
      "G",
      "B",
      "Y",
      "B",
      "Y"
    ],
    "tickDurationMs": 700,
    "spawnCadenceTicks": 2,
    "activeJunctions": [
      "J1",
      "J2",
      "J3"
    ],
    "initialJ1": "LEFT",
    "initialJ2": "RED",
    "initialJ3": "GREEN",
    "maxMistakes": 3,
    "maxConcurrentVehicles": null,
    "spawnPreparationMs": null,
    "hint": null
  },
  {
    "id": 7,
    "title": "Senaryo 7",
    "mode": "classic",
    "district": null,
    "levelFamily": null,
    "primaryChallenge": null,
    "manifest": [
      "R",
      "B",
      "Y",
      "G",
      "Y",
      "B",
      "R",
      "G",
      "R",
      "B"
    ],
    "tickDurationMs": 700,
    "spawnCadenceTicks": 2,
    "activeJunctions": [
      "J1",
      "J2",
      "J3"
    ],
    "initialJ1": "LEFT",
    "initialJ2": "RED",
    "initialJ3": "GREEN",
    "maxMistakes": 3,
    "maxConcurrentVehicles": null,
    "spawnPreparationMs": null,
    "hint": null
  },
  {
    "id": 8,
    "title": "Senaryo 8",
    "mode": "classic",
    "district": null,
    "levelFamily": null,
    "primaryChallenge": null,
    "manifest": [
      "G",
      "R",
      "Y",
      "B",
      "G",
      "B",
      "Y",
      "R",
      "G",
      "Y"
    ],
    "tickDurationMs": 700,
    "spawnCadenceTicks": 2,
    "activeJunctions": [
      "J1",
      "J2",
      "J3"
    ],
    "initialJ1": "LEFT",
    "initialJ2": "RED",
    "initialJ3": "GREEN",
    "maxMistakes": 3,
    "maxConcurrentVehicles": null,
    "spawnPreparationMs": null,
    "hint": null
  },
  {
    "id": 9,
    "title": "Senaryo 9",
    "mode": "classic",
    "district": null,
    "levelFamily": null,
    "primaryChallenge": null,
    "manifest": [
      "B",
      "Y",
      "R",
      "G",
      "B",
      "G",
      "R",
      "Y",
      "B",
      "G"
    ],
    "tickDurationMs": 700,
    "spawnCadenceTicks": 2,
    "activeJunctions": [
      "J1",
      "J2",
      "J3"
    ],
    "initialJ1": "LEFT",
    "initialJ2": "RED",
    "initialJ3": "GREEN",
    "maxMistakes": 3,
    "maxConcurrentVehicles": null,
    "spawnPreparationMs": null,
    "hint": null
  },
  {
    "id": 10,
    "title": "Senaryo 10",
    "mode": "classic",
    "district": null,
    "levelFamily": null,
    "primaryChallenge": null,
    "manifest": [
      "R",
      "G",
      "B",
      "Y",
      "Y",
      "B",
      "G",
      "R",
      "B",
      "Y",
      "R",
      "G"
    ],
    "tickDurationMs": 700,
    "spawnCadenceTicks": 2,
    "activeJunctions": [
      "J1",
      "J2",
      "J3"
    ],
    "initialJ1": "LEFT",
    "initialJ2": "RED",
    "initialJ3": "GREEN",
    "maxMistakes": 3,
    "maxConcurrentVehicles": null,
    "spawnPreparationMs": null,
    "hint": null
  }
]